{"bounds":[0,0,1200,544],"description":"Hand-placed fixture for viewer development; not produced by ELK.","edges":[{"description":"Reads from and writes to","id":"live/amazon-web-services/ap-southeast-1/autoscaling-group/amazon-ec2-ubuntu-server/web-application->live/amazon-web-services/ap-southeast-1/amazon-rds/mysql/database-schema","label":{"h":18,"lines":[{"size":12,"text":"Reads from and writes to"}],"w":160,"x":702,"y":138},"modelId":"23","order":null,"points":[[622,162],[900,162]],"source":"live/amazon-web-services/ap-southeast-1/autoscaling-group/amazon-ec2-ubuntu-server/web-application","style":{"arrow":"end","dash":[5,5],"stroke":"#707070"},"tags":["Relationship"],"target":"live/amazon-web-services/ap-southeast-1/amazon-rds/mysql/database-schema"},{"description":"Fowards requests to","id":"live/amazon-web-services/ap-southeast-1/dns-router->live/amazon-web-services/ap-southeast-1/load-balancer","label":{"h":32,"lines":[{"size":12,"text":"Fowards requests to"},{"size":11,"text":"[HTTP]"}],"w":130,"x":180,"y":246},"modelId":"15","order":null,"points":[[172,192],[172,332]],"source":"live/amazon-web-services/ap-southeast-1/dns-router","style":{"arrow":"end","dash":[5,5],"stroke":"#707070"},"tags":["Relationship"],"target":"live/amazon-web-services/ap-southeast-1/load-balancer","technology":"HTTP"},{"description":"Forwards requests to","id":"live/amazon-web-services/ap-southeast-1/load-balancer->live/amazon-web-services/ap-southeast-1/autoscaling-group/amazon-ec2-ubuntu-server/web-application","label":{"h":18,"lines":[{"size":12,"text":"Forwards requests to"}],"w":130,"x":290,"y":310},"modelId":"22","order":null,"points":[[282,392],[307,392],[307,162],[402,162]],"source":"live/amazon-web-services/ap-southeast-1/load-balancer","style":{"arrow":"end","dash":[5,5],"stroke":"#707070"},"tags":["Relationship"],"target":"live/amazon-web-services/ap-southeast-1/autoscaling-group/amazon-ec2-ubuntu-server/web-application"}],"kind":"deployment","layout":{"direction":"RIGHT","engine":"hand","inputHash":"sha256:unknown","version":"0"},"modelHash":"sha256:unknown","nodes":[{"h":520,"id":"live/amazon-web-services","label":{"anchor":"bottom-left","lines":[{"text":"Amazon Web Services","weight":"bold"},{"size":11,"text":"[Deployment Node]"}]},"modelId":"11","name":"Amazon Web Services","parent":null,"role":"boundary","shape":"Box","style":{"color":"#000000","dash":[6,4],"fill":"#ffffff","fontSize":13,"stroke":"#888888"},"tags":["Element","Deployment Node","Amazon Web Services - Cloud"],"type":"DeploymentNode","w":1176,"x":12,"y":12},{"h":470,"id":"live/amazon-web-services/ap-southeast-1","label":{"anchor":"bottom-left","lines":[{"text":"ap-southeast-1","weight":"bold"},{"size":11,"text":"[Deployment Node]"}]},"modelId":"12","name":"ap-southeast-1","parent":"live/amazon-web-services","role":"boundary","shape":"Box","style":{"color":"#000000","dash":[6,4],"fill":"#ffffff","fontSize":13,"stroke":"#888888"},"tags":["Element","Deployment Node","Amazon Web Services - Region"],"type":"DeploymentNode","w":1136,"x":32,"y":32},{"h":250,"id":"live/amazon-web-services/ap-southeast-1/amazon-rds","label":{"anchor":"bottom-left","lines":[{"text":"Amazon RDS","weight":"bold"},{"size":11,"text":"[Deployment Node]"}]},"modelId":"19","name":"Amazon RDS","parent":"live/amazon-web-services/ap-southeast-1","role":"boundary","shape":"Box","style":{"color":"#000000","dash":[6,4],"fill":"#ffffff","fontSize":13,"stroke":"#888888"},"tags":["Element","Deployment Node","Amazon Web Services - RDS Instance"],"type":"DeploymentNode","w":276,"x":872,"y":52},{"h":200,"id":"live/amazon-web-services/ap-southeast-1/amazon-rds/mysql","label":{"anchor":"bottom-left","lines":[{"text":"MySQL","weight":"bold"},{"size":11,"text":"[Deployment Node]"}]},"modelId":"20","name":"MySQL","parent":"live/amazon-web-services/ap-southeast-1/amazon-rds","role":"boundary","shape":"Box","style":{"color":"#000000","dash":[6,4],"fill":"#ffffff","fontSize":13,"stroke":"#888888"},"tags":["Element","Deployment Node","Amazon Web Services - RDS MySQL instance"],"type":"DeploymentNode","w":236,"x":892,"y":72},{"h":120,"id":"live/amazon-web-services/ap-southeast-1/amazon-rds/mysql/database-schema","label":{"anchor":"center","lines":[{"text":"Database Schema","weight":"bold"},{"size":12,"text":"[Container]"}]},"lod":{"detail":["name","type","description"]},"modelId":"21","name":"Database Schema","parent":"live/amazon-web-services/ap-southeast-1/amazon-rds/mysql","role":"element","shape":"Cylinder","style":{"color":"#000000","fill":"#ffffff","fontSize":14,"stroke":"#9a9a9a"},"tags":["Container Instance"],"type":"ContainerInstance","w":220,"x":900,"y":102},{"h":250,"id":"live/amazon-web-services/ap-southeast-1/autoscaling-group","label":{"anchor":"bottom-left","lines":[{"text":"Autoscaling Group","weight":"bold"},{"size":11,"text":"[Deployment Node]"}]},"modelId":"16","name":"Autoscaling Group","parent":"live/amazon-web-services/ap-southeast-1","role":"boundary","shape":"Box","style":{"color":"#000000","dash":[6,4],"fill":"#ffffff","fontSize":13,"stroke":"#888888"},"tags":["Element","Deployment Node","Amazon Web Services - Autoscaling Group"],"type":"DeploymentNode","w":360,"x":332,"y":52},{"h":200,"id":"live/amazon-web-services/ap-southeast-1/autoscaling-group/amazon-ec2-ubuntu-server","label":{"anchor":"bottom-left","lines":[{"text":"Amazon EC2 - Ubuntu Server","weight":"bold"},{"size":11,"text":"[Deployment Node]"}]},"modelId":"17","name":"Amazon EC2 - Ubuntu Server","parent":"live/amazon-web-services/ap-southeast-1/autoscaling-group","role":"boundary","shape":"Box","style":{"color":"#000000","dash":[6,4],"fill":"#ffffff","fontSize":13,"stroke":"#888888"},"tags":["Element","Deployment Node","Amazon Web Services - EC2 Instance"],"type":"DeploymentNode","w":320,"x":352,"y":72},{"h":120,"id":"live/amazon-web-services/ap-southeast-1/autoscaling-group/amazon-ec2-ubuntu-server/web-application","label":{"anchor":"center","lines":[{"text":"Web Application","weight":"bold"},{"size":12,"text":"[Container: Java and Spring boot]"}]},"lod":{"detail":["name","type","description"]},"modelId":"18","name":"Web Application","parent":"live/amazon-web-services/ap-southeast-1/autoscaling-group/amazon-ec2-ubuntu-server","role":"element","shape":"Box","style":{"color":"#000000","fill":"#ffffff","fontSize":14,"stroke":"#9a9a9a"},"tags":["Container Instance"],"technology":"Java and Spring boot","type":"ContainerInstance","w":220,"x":402,"y":102},{"description":"Routes incoming requests based upon domain name.","h":120,"id":"live/amazon-web-services/ap-southeast-1/dns-router","label":{"anchor":"center","lines":[{"text":"DNS Router","weight":"bold"},{"size":12,"text":"[Infrastructure Node: Route 53]"},{"size":12,"text":"Routes incoming requests based"},{"size":12,"text":"upon domain name."}]},"lod":{"detail":["name","type","description"]},"modelId":"13","name":"DNS Router","parent":"live/amazon-web-services/ap-southeast-1","role":"element","shape":"Box","style":{"color":"#000000","fill":"#dddddd","fontSize":14,"stroke":"#9a9a9a"},"tags":["Element","Infrastructure Node","Amazon Web Services - Route 53"],"technology":"Route 53","type":"InfrastructureNode","w":220,"x":62,"y":72},{"description":"Automatically distributes incoming application traffic.","h":120,"id":"live/amazon-web-services/ap-southeast-1/load-balancer","label":{"anchor":"center","lines":[{"text":"Load Balancer","weight":"bold"},{"size":12,"text":"[Infrastructure Node: Elastic Load Balancer]"},{"size":12,"text":"Automatically distributes"},{"size":12,"text":"incoming application traffic."}]},"lod":{"detail":["name","type","description"]},"modelId":"14","name":"Load Balancer","parent":"live/amazon-web-services/ap-southeast-1","role":"element","shape":"Box","style":{"color":"#000000","fill":"#dddddd","fontSize":14,"stroke":"#9a9a9a"},"tags":["Element","Infrastructure Node","Amazon Web Services - Elastic Load Balancer"],"technology":"Elastic Load Balancer","type":"InfrastructureNode","w":220,"x":62,"y":332}],"schema":"buildzr.scene/1","title":"AWS deployment (hand-written fixture)","view":"aws-mini"}
