{"bounds":[0,0,816.81,216],"description":"Web App System Context","edges":[{"description":"sends notification using","id":"corporate-web-app->microsoft-365","label":{"h":19,"lines":[{"size":12,"text":"sends notification using"}],"w":142.81,"x":337,"y":101},"modelId":"43","order":null,"points":[[272,96],[544.81,96]],"source":"corporate-web-app","style":{"arrow":"end","dash":[5,5],"stroke":"#707070"},"tags":["Relationship"],"target":"microsoft-365"}],"kind":"systemContext","layout":{"direction":"RIGHT","engine":"elkjs","inputHash":"sha256:fa14a04f032e868b0b608e6c8c661b45091ab9faefc8fbb50ca19c6630176a1a","options":{"elk.algorithm":"layered","elk.direction":"RIGHT","elk.edgeRouting":"ORTHOGONAL","elk.hierarchyHandling":"INCLUDE_CHILDREN","elk.layered.considerModelOrder.strategy":"NONE","elk.layered.spacing.edgeEdgeBetweenLayers":"10","elk.layered.spacing.edgeNodeBetweenLayers":"10","elk.layered.spacing.nodeNodeBetweenLayers":"40","elk.padding":"[top=12,left=12,bottom=12,right=12]","elk.spacing.edgeEdge":"10","elk.spacing.edgeLabel":"4","elk.spacing.edgeNode":"10","elk.spacing.nodeNode":"25"},"version":"0.12.0"},"modelHash":"sha256:e5713bea3a15ecb47201e4978b631f25a513b7db748d9606adad12dfb4bb9a34","nodes":[{"h":192,"id":"microsoft","label":{"anchor":"bottom-left","lines":[{"text":"Microsoft","weight":"bold"}]},"modelId":"group:Microsoft","name":"Microsoft","parent":null,"role":"boundary","shape":"Box","style":{"color":"#000000","dash":[6,4],"fill":"#ffffff","fontSize":13,"stroke":"#888888"},"tags":["Element","Group"],"type":"Group","w":280,"x":524.81,"y":12},{"h":120,"id":"microsoft-365","label":{"anchor":"center","lines":[{"text":"Microsoft 365","weight":"bold"},{"size":12,"text":"[Software System]"}]},"lod":{"detail":["name","type","description"]},"modelId":"40","name":"Microsoft 365","parent":"microsoft","role":"element","shape":"Box","style":{"color":"#ffffff","fill":"#1168bd","fontSize":14,"stroke":"#0b4884"},"tags":["Element","Software System"],"type":"SoftwareSystem","w":240,"x":544.81,"y":36},{"h":192,"id":"my-company","label":{"anchor":"bottom-left","lines":[{"text":"My Company","weight":"bold"}]},"modelId":"group:My Company","name":"My Company","parent":null,"role":"boundary","shape":"Box","style":{"color":"#000000","dash":[6,4],"fill":"#ffffff","fontSize":13,"stroke":"#888888"},"tags":["Element","Group"],"type":"Group","w":280,"x":12,"y":12},{"h":120,"id":"corporate-web-app","label":{"anchor":"center","lines":[{"text":"Corporate Web App","weight":"bold"},{"size":12,"text":"[Software System]"}]},"lod":{"detail":["name","type","description"]},"modelId":"36","name":"Corporate Web App","parent":"my-company","role":"element","shape":"Box","style":{"color":"#ffffff","fill":"#1168bd","fontSize":14,"stroke":"#0b4884"},"tags":["Element","Software System"],"type":"SoftwareSystem","w":240,"x":32,"y":36}],"schema":"buildzr.scene/1","title":"Web App System Context","view":"web_app_system_context_00"}
