{"bounds":[0,0,264,376.75],"description":"System context of X","edges":[{"description":"Uses","id":"user->x","label":{"h":32.75,"lines":[{"size":12,"text":"Uses"},{"size":11,"text":"[browser]"}],"w":58.86,"x":69.14,"y":172},"modelId":"9","order":null,"points":[[132,132],[132,244.75]],"source":"user","style":{"arrow":"end","dash":[5,5],"stroke":"#707070"},"tags":["Relationship"],"target":"x","technology":"browser"}],"kind":"systemContext","layout":{"direction":"DOWN","engine":"elkjs","inputHash":"sha256:61701424608ff95fac32b6930535e309373db3f0a382bccf0b6ce17ff7a326c5","options":{"elk.algorithm":"layered","elk.direction":"DOWN","elk.edgeRouting":"ORTHOGONAL","elk.hierarchyHandling":"INCLUDE_CHILDREN","elk.layered.considerModelOrder.strategy":"NONE","elk.layered.spacing.edgeEdgeBetweenLayers":"10","elk.layered.spacing.edgeNodeBetweenLayers":"10","elk.layered.spacing.nodeNodeBetweenLayers":"40","elk.padding":"[top=12,left=12,bottom=12,right=12]","elk.spacing.edgeEdge":"10","elk.spacing.edgeLabel":"4","elk.spacing.edgeNode":"10","elk.spacing.nodeNode":"25"},"version":"0.12.0"},"modelHash":"sha256:e92e4209b58c7de672c25f1809645e12ba39f61a391145453cf62dc6b65ef3d3","nodes":[{"description":"An ordinary user.","h":120,"id":"user","label":{"anchor":"center","lines":[{"text":"User","weight":"bold"},{"size":12,"text":"[Person]"},{"size":12,"text":"An ordinary user."}]},"lod":{"detail":["name","type","description"]},"modelId":"1","name":"User","parent":null,"role":"element","shape":"Person","style":{"color":"#000000","fill":"#ffffff","fontSize":14,"stroke":"#b2b2b2"},"tags":["Element","Person","buildzr-styleelements-237cab22f28e"],"type":"Person","w":240,"x":12,"y":12},{"h":120,"id":"x","label":{"anchor":"center","lines":[{"text":"X","weight":"bold"},{"size":12,"text":"[Software System]"}]},"lod":{"detail":["name","type","description"]},"modelId":"2","name":"X","parent":null,"role":"element","shape":"Box","style":{"color":"#000000","fill":"#ffffff","fontSize":14,"stroke":"#b2b2b2"},"tags":["Element","Software System"],"type":"SoftwareSystem","w":240,"x":12,"y":244.75}],"schema":"buildzr.scene/1","title":"System context of X","view":"x_context_00"}
