{"bounds":[0,0,803.18,288],"description":"Web App Container View","edges":[{"description":"Reads and writes data from/to","id":"corporate-web-app/api->corporate-web-app/database","label":{"h":32.75,"lines":[{"size":12,"text":"Reads and writes data from/to"},{"size":11,"text":"[http/api]"}],"w":179.18,"x":312,"y":123},"modelId":"39","order":null,"points":[[292,120],[511.18,120]],"source":"corporate-web-app/api","style":{"arrow":"end","dash":[5,5],"stroke":"#707070"},"tags":["Relationship"],"target":"corporate-web-app/database","technology":"http/api"}],"kind":"container","layout":{"direction":"RIGHT","engine":"elkjs","inputHash":"sha256:3249619909fd685cda35188b369ec318502bfef945bddc7bfd0f9137f245c935","options":{"elk.algorithm":"layered","elk.direction":"RIGHT","elk.edgeRouting":"ORTHOGONAL","elk.hierarchyHandling":"INCLUDE_CHILDREN","elk.layered.considerModelOrder.strategy":"NONE","elk.layered.spacing.edgeEdgeBetweenLayers":"10","elk.layered.spacing.edgeNodeBetweenLayers":"10","elk.layered.spacing.nodeNodeBetweenLayers":"40","elk.padding":"[top=12,left=12,bottom=12,right=12]","elk.spacing.edgeEdge":"10","elk.spacing.edgeLabel":"4","elk.spacing.edgeNode":"10","elk.spacing.nodeNode":"25"},"version":"0.12.0"},"modelHash":"sha256:e5713bea3a15ecb47201e4978b631f25a513b7db748d9606adad12dfb4bb9a34","nodes":[{"h":264,"id":"my-company","label":{"anchor":"bottom-left","lines":[{"text":"My Company","weight":"bold"}]},"modelId":"group:My Company","name":"My Company","parent":null,"role":"boundary","shape":"Box","style":{"color":"#000000","dash":[6,4],"fill":"#ffffff","fontSize":13,"stroke":"#888888"},"tags":["Element","Group"],"type":"Group","w":779.18,"x":12,"y":12},{"h":192,"id":"corporate-web-app","label":{"anchor":"bottom-left","lines":[{"text":"Corporate Web App","weight":"bold"},{"size":11,"text":"[Software System]"}]},"modelId":"36","name":"Corporate Web App","parent":"my-company","role":"boundary","shape":"Box","style":{"color":"#000000","dash":[6,4],"fill":"#ffffff","fontSize":13,"stroke":"#1168bd"},"tags":["Element","Software System"],"type":"SoftwareSystem","w":739.18,"x":32,"y":36},{"h":120,"id":"corporate-web-app/api","label":{"anchor":"center","lines":[{"text":"api","weight":"bold"},{"size":12,"text":"[Container]"}]},"lod":{"detail":["name","type","description"]},"modelId":"38","name":"api","parent":"corporate-web-app","role":"element","shape":"Box","style":{"color":"#000000","fill":"#438dd5","fontSize":14,"stroke":"#2e6295"},"tags":["Element","Container"],"type":"Container","w":240,"x":52,"y":60},{"h":120,"id":"corporate-web-app/database","label":{"anchor":"center","lines":[{"text":"database","weight":"bold"},{"size":12,"text":"[Container]"}]},"lod":{"detail":["name","type","description"]},"modelId":"37","name":"database","parent":"corporate-web-app","role":"element","shape":"Box","style":{"color":"#000000","fill":"#438dd5","fontSize":14,"stroke":"#2e6295"},"tags":["Element","Container"],"type":"Container","w":240,"x":511.18,"y":60}],"schema":"buildzr.scene/1","title":"Web App Container View","view":"web_app_container_view_00"}
